,tweet_id,timestamp,source,text,expanded_urls,rating_numerator,rating_denominator,name,stage,jpg_url,img_num,breed,retweet_count,favorite_count
0,892177421306343426,2017-08-01 00:17:27+00:00,"<a href=""http://twitter.com/download/iphone"" rel=""nofollow"">Twitter for iPhone</a>","This is Tilly. She's just checking pup on you. Hopes you're doing ok. If not, she's available for pats, snugs, boops, the whole bit. 13/10 https://t.co/0Xxu71qeIV",https://twitter.com/dog_rates/status/892177421306343426/photo/1,13,10,Tilly,,https://pbs.twimg.com/media/DGGmoV4XsAAUL6n.jpg,1,Chihuahua,5385,29872
1,891815181378084864,2017-07-31 00:18:03+00:00,"<a href=""http://twitter.com/download/iphone"" rel=""nofollow"">Twitter for iPhone</a>",This is Archie. He is a rare Norwegian Pouncing Corgo. Lives in the tall grass. You never know when one may strike. 12/10 https://t.co/wUnZnhtVJB,https://twitter.com/dog_rates/status/891815181378084864/photo/1,12,10,Archie,,https://pbs.twimg.com/media/DGBdLU1WsAANxJ9.jpg,1,Chihuahua,3550,22486
2,891689557279858688,2017-07-30 15:58:51+00:00,"<a href=""http://twitter.com/download/iphone"" rel=""nofollow"">Twitter for iPhone</a>",This is Darla. She commenced a snooze mid meal. 13/10 happens to the best of us https://t.co/tD36da7qLQ,https://twitter.com/dog_rates/status/891689557279858688/photo/1,13,10,Darla,,https://pbs.twimg.com/media/DF_q7IAWsAEuuN8.jpg,1,Labrador Retriever,7375,37659
3,891327558926688256,2017-07-29 16:00:24+00:00,"<a href=""http://twitter.com/download/iphone"" rel=""nofollow"">Twitter for iPhone</a>","This is Franklin. He would like you to stop calling him ""cute."" He is a very fierce shark and should be respected as such. 12/10 #BarkWeek https://t.co/AtUZn91f7f","https://twitter.com/dog_rates/status/891327558926688256/photo/1,https://twitter.com/dog_rates/status/891327558926688256/photo/1",12,10,Franklin,,https://pbs.twimg.com/media/DF6hr6BUMAAzZgT.jpg,2,Basset,7918,35974
4,891087950875897856,2017-07-29 00:08:17+00:00,"<a href=""http://twitter.com/download/iphone"" rel=""nofollow"">Twitter for iPhone</a>",Here we have a majestic great white breaching off South Africa's coast. Absolutely h*ckin breathtaking. 13/10 (IG: tucker_marlo) #BarkWeek https://t.co/kQ04fDDRmh,https://twitter.com/dog_rates/status/891087950875897856/photo/1,13,10,,,https://pbs.twimg.com/media/DF3HwyEWsAABqE6.jpg,1,Chesapeake Bay Retriever,2664,18146
5,890971913173991426,2017-07-28 16:27:12+00:00,"<a href=""http://twitter.com/download/iphone"" rel=""nofollow"">Twitter for iPhone</a>","Meet Jax. He enjoys ice cream so much he gets nervous around it. 13/10 help Jax enjoy more things by clicking below

https://t.co/Zr4hWfAs1H https://t.co/tVJBRMnhxl","https://gofundme.com/ydvmve-surgery-for-jax,https://twitter.com/dog_rates/status/890971913173991426/photo/1",13,10,Jax,,https://pbs.twimg.com/media/DF1eOmZXUAALUcq.jpg,1,Appenzeller,1708,10572
6,890729181411237888,2017-07-28 00:22:40+00:00,"<a href=""http://twitter.com/download/iphone"" rel=""nofollow"">Twitter for iPhone</a>",When you watch your owner call another dog a good boy but then they turn back to you and say you're a great boy. 13/10 https://t.co/v0nONBcwxq,"https://twitter.com/dog_rates/status/890729181411237888/photo/1,https://twitter.com/dog_rates/status/890729181411237888/photo/1",13,10,,,https://pbs.twimg.com/media/DFyBahAVwAAhUTd.jpg,2,Pomeranian,16112,57969
7,890609185150312448,2017-07-27 16:25:51+00:00,"<a href=""http://twitter.com/download/iphone"" rel=""nofollow"">Twitter for iPhone</a>",This is Zoey. She doesn't want to be one of the scary sharks. Just wants to be a snuggly pettable boatpet. 13/10 #BarkWeek https://t.co/9TwLuAGH0b,https://twitter.com/dog_rates/status/890609185150312448/photo/1,13,10,Zoey,,https://pbs.twimg.com/media/DFwUU__XcAEpyXI.jpg,1,Irish Terrier,3694,24995
8,890240255349198849,2017-07-26 15:59:51+00:00,"<a href=""http://twitter.com/download/iphone"" rel=""nofollow"">Twitter for iPhone</a>",This is Cassie. She is a college pup. Studying international doggo communication and stick theory. 14/10 so elegant much sophisticate https://t.co/t1bfwz5S2A,https://twitter.com/dog_rates/status/890240255349198849/photo/1,14,10,Cassie,doggo,https://pbs.twimg.com/media/DFrEyVuW0AAO3t9.jpg,1,Pembroke,6216,28504
9,890006608113172480,2017-07-26 00:31:25+00:00,"<a href=""http://twitter.com/download/iphone"" rel=""nofollow"">Twitter for iPhone</a>",This is Koda. He is a South Australian deckshark. Deceptively deadly. Frighteningly majestic. 13/10 would risk a petting #BarkWeek https://t.co/dVPW0B0Mme,"https://twitter.com/dog_rates/status/890006608113172480/photo/1,https://twitter.com/dog_rates/status/890006608113172480/photo/1",13,10,Koda,,https://pbs.twimg.com/media/DFnwSY4WAAAMliS.jpg,1,Samoyed,6271,27525
10,889880896479866881,2017-07-25 16:11:53+00:00,"<a href=""http://twitter.com/download/iphone"" rel=""nofollow"">Twitter for iPhone</a>",This is Bruno. He is a service shark. Only gets out of the water to assist you. 13/10 terrifyingly good boy https://t.co/u1XPQMl29g,https://twitter.com/dog_rates/status/889880896479866881/photo/1,13,10,Bruno,,https://pbs.twimg.com/media/DFl99B1WsAITKsg.jpg,1,French Bulldog,4251,25030
11,889665388333682689,2017-07-25 01:55:32+00:00,"<a href=""http://twitter.com/download/iphone"" rel=""nofollow"">Twitter for iPhone</a>",Here's a puppo that seems to be on the fence about something haha no but seriously someone help her. 13/10 https://t.co/BxvuXk0UCm,https://twitter.com/dog_rates/status/889665388333682689/photo/1,13,10,,puppo,https://pbs.twimg.com/media/DFi579UWsAAatzw.jpg,1,Pembroke,8531,42874
12,889638837579907072,2017-07-25 00:10:02+00:00,"<a href=""http://twitter.com/download/iphone"" rel=""nofollow"">Twitter for iPhone</a>",This is Ted. He does his best. Sometimes that's not enough. But it's ok. 12/10 would assist https://t.co/f8dEDcrKSR,"https://twitter.com/dog_rates/status/889638837579907072/photo/1,https://twitter.com/dog_rates/status/889638837579907072/photo/1",12,10,Ted,,https://pbs.twimg.com/media/DFihzFfXsAYGDPR.jpg,1,French Bulldog,3804,24116
13,889531135344209921,2017-07-24 17:02:04+00:00,"<a href=""http://twitter.com/download/iphone"" rel=""nofollow"">Twitter for iPhone</a>",This is Stuart. He's sporting his favorite fanny pack. Secretly filled with bones only. 13/10 puppared puppo #BarkWeek https://t.co/y70o6h3isq,https://twitter.com/dog_rates/status/889531135344209921/photo/1,13,10,Stuart,puppo,https://pbs.twimg.com/media/DFg_2PVW0AEHN3p.jpg,1,Golden Retriever,1918,13597
14,889278841981685760,2017-07-24 00:19:32+00:00,"<a href=""http://twitter.com/download/iphone"" rel=""nofollow"">Twitter for iPhone</a>",This is Oliver. You're witnessing one of his many brutal attacks. Seems to be playing with his victim. 13/10 fr*ckin frightening #BarkWeek https://t.co/WpHvrQedPb,https://twitter.com/dog_rates/status/889278841981685760/video/1,13,10,Oliver,,https://pbs.twimg.com/ext_tw_video_thumb/889278779352338437/pu/img/VlbFB3v8H8VwzVNY.jpg,1,Whippet,4535,22540
15,888917238123831296,2017-07-23 00:22:39+00:00,"<a href=""http://twitter.com/download/iphone"" rel=""nofollow"">Twitter for iPhone</a>",This is Jim. He found a fren. Taught him how to sit like the good boys. 12/10 for both https://t.co/chxruIOUJN,https://twitter.com/dog_rates/status/888917238123831296/photo/1,12,10,Jim,,https://pbs.twimg.com/media/DFYRgsOUQAARGhO.jpg,1,Golden Retriever,3830,26110
16,888804989199671297,2017-07-22 16:56:37+00:00,"<a href=""http://twitter.com/download/iphone"" rel=""nofollow"">Twitter for iPhone</a>",This is Zeke. He has a new stick. Very proud of it. Would like you to throw it for him without taking it. 13/10 would do my best https://t.co/HTQ77yNQ5K,"https://twitter.com/dog_rates/status/888804989199671297/photo/1,https://twitter.com/dog_rates/status/888804989199671297/photo/1",13,10,Zeke,,https://pbs.twimg.com/media/DFWra-3VYAA2piG.jpg,1,Golden Retriever,3613,22890
17,888554962724278272,2017-07-22 00:23:06+00:00,"<a href=""http://twitter.com/download/iphone"" rel=""nofollow"">Twitter for iPhone</a>",This is Ralphus. He's powering up. Attempting maximum borkdrive. 13/10 inspirational af https://t.co/YnYAFCTTiK,"https://twitter.com/dog_rates/status/888554962724278272/photo/1,https://twitter.com/dog_rates/status/888554962724278272/photo/1,https://twitter.com/dog_rates/status/888554962724278272/photo/1,https://twitter.com/dog_rates/status/888554962724278272/photo/1",13,10,Ralphus,,https://pbs.twimg.com/media/DFTH_O-UQAACu20.jpg,3,Siberian Husky,2937,17652
18,888078434458587136,2017-07-20 16:49:33+00:00,"<a href=""http://twitter.com/download/iphone"" rel=""nofollow"">Twitter for iPhone</a>",This is Gerald. He was just told he didn't get the job he interviewed for. A h*ckin injustice. 12/10 didn't want the job anyway https://t.co/DK7iDPfuRX,"https://twitter.com/dog_rates/status/888078434458587136/photo/1,https://twitter.com/dog_rates/status/888078434458587136/photo/1",12,10,Gerald,,https://pbs.twimg.com/media/DFMWn56WsAAkA7B.jpg,1,French Bulldog,2960,19495
19,887705289381826560,2017-07-19 16:06:48+00:00,"<a href=""http://twitter.com/download/iphone"" rel=""nofollow"">Twitter for iPhone</a>",This is Jeffrey. He has a monopoly on the pool noodles. Currently running a 'boop for two' midweek sale. 13/10 h*ckin strategic https://t.co/PhrUk20Q64,https://twitter.com/dog_rates/status/887705289381826560/photo/1,13,10,Jeffrey,,https://pbs.twimg.com/media/DFHDQBbXgAEqY7t.jpg,1,Basset,4626,27116
20,887473957103951883,2017-07-19 00:47:34+00:00,"<a href=""http://twitter.com/download/iphone"" rel=""nofollow"">Twitter for iPhone</a>",This is Canela. She attempted some fancy porch pics. They were unsuccessful. 13/10 someone help her https://t.co/cLyzpcUcMX,"https://twitter.com/dog_rates/status/887473957103951883/photo/1,https://twitter.com/dog_rates/status/887473957103951883/photo/1",13,10,Canela,,https://pbs.twimg.com/media/DFDw2tyUQAAAFke.jpg,2,Pembroke,15333,61356
21,887343217045368832,2017-07-18 16:08:03+00:00,"<a href=""http://twitter.com/download/iphone"" rel=""nofollow"">Twitter for iPhone</a>",You may not have known you needed to see this today. 13/10 please enjoy (IG: emmylouroo) https://t.co/WZqNqygEyV,https://twitter.com/dog_rates/status/887343217045368832/video/1,13,10,,,https://pbs.twimg.com/ext_tw_video_thumb/887343120832229379/pu/img/6HSuFrW1lzI_9Mht.jpg,1,Mexican Hairless,8988,30133
22,887101392804085760,2017-07-18 00:07:08+00:00,"<a href=""http://twitter.com/download/iphone"" rel=""nofollow"">Twitter for iPhone</a>",This... is a Jubilant Antarctic House Bear. We only rate dogs. Please only send dogs. Thank you... 12/10 would suffocate in floof https://t.co/4Ad1jzJSdp,https://twitter.com/dog_rates/status/887101392804085760/photo/1,12,10,,,https://pbs.twimg.com/media/DE-eAq6UwAA-jaE.jpg,1,Samoyed,5086,27481
23,886983233522544640,2017-07-17 16:17:36+00:00,"<a href=""http://twitter.com/download/iphone"" rel=""nofollow"">Twitter for iPhone</a>",This is Maya. She's very shy. Rarely leaves her cup. 13/10 would find her an environment to thrive in https://t.co/I6oNy0CgiT,"https://twitter.com/dog_rates/status/886983233522544640/photo/1,https://twitter.com/dog_rates/status/886983233522544640/photo/1",13,10,Maya,,https://pbs.twimg.com/media/DE8yicJW0AAAvBJ.jpg,2,Chihuahua,6482,30976
24,886736880519319552,2017-07-16 23:58:41+00:00,"<a href=""http://twitter.com/download/iphone"" rel=""nofollow"">Twitter for iPhone</a>","This is Mingus. He's a wonderful father to his smol pup. Confirmed 13/10, but he needs your help

https://t.co/bVi0Yr4Cff https://t.co/ISvKOSkd5b","https://www.gofundme.com/mingusneedsus,https://twitter.com/dog_rates/status/886736880519319552/photo/1,https://twitter.com/dog_rates/status/886736880519319552/photo/1",13,10,Mingus,,https://pbs.twimg.com/media/DE5Se8FXcAAJFx4.jpg,1,Kuvasz,2701,10680
25,886366144734445568,2017-07-15 23:25:31+00:00,"<a href=""http://twitter.com/download/iphone"" rel=""nofollow"">Twitter for iPhone</a>",This is Roscoe. Another pupper fallen victim to spontaneous tongue ejections. Get the BlepiPen immediate. 12/10 deep breaths Roscoe https://t.co/RGE08MIJox,"https://twitter.com/dog_rates/status/886366144734445568/photo/1,https://twitter.com/dog_rates/status/886366144734445568/photo/1",12,10,Roscoe,pupper,https://pbs.twimg.com/media/DE0BTnQUwAApKEH.jpg,1,French Bulldog,2691,18894
26,886258384151887873,2017-07-15 16:17:19+00:00,"<a href=""http://twitter.com/download/iphone"" rel=""nofollow"">Twitter for iPhone</a>",This is Waffles. His doggles are pupside down. Unsure how to fix. 13/10 someone assist Waffles https://t.co/xZDA9Qsq1O,https://twitter.com/dog_rates/status/886258384151887873/photo/1,13,10,Waffles,,https://pbs.twimg.com/media/DEyfTG4UMAE4aE9.jpg,1,Pug,5390,25015
27,885984800019947520,2017-07-14 22:10:11+00:00,"<a href=""http://twitter.com/download/iphone"" rel=""nofollow"">Twitter for iPhone</a>",Viewer discretion advised. This is Jimbo. He will rip ur finger right h*ckin off. Other dog clearly an accessory. 12/10 pls pet with caution https://t.co/BuveP0uMF1,https://twitter.com/dog_rates/status/885984800019947520/photo/1,12,10,Jimbo,,https://pbs.twimg.com/media/DEumeWWV0AA-Z61.jpg,1,Blenheim Spaniel,5733,29140
28,885528943205470208,2017-07-13 15:58:47+00:00,"<a href=""http://twitter.com/download/iphone"" rel=""nofollow"">Twitter for iPhone</a>",This is Maisey. She fell asleep mid-excavation. Happens to the best of us. 13/10 would pat noggin approvingly https://t.co/tp1kQ8i9JF,https://twitter.com/dog_rates/status/885528943205470208/photo/1,13,10,Maisey,,https://pbs.twimg.com/media/DEoH3yvXgAAzQtS.jpg,1,Pug,5448,32179
29,885167619883638784,2017-07-12 16:03:00+00:00,"<a href=""http://twitter.com/download/iphone"" rel=""nofollow"">Twitter for iPhone</a>",Here we have a corgi undercover as a malamute. Pawbably doing important investigative work. Zero control over tongue happenings. 13/10 https://t.co/44ItaMubBf,"https://twitter.com/dog_rates/status/885167619883638784/photo/1,https://twitter.com/dog_rates/status/885167619883638784/photo/1,https://twitter.com/dog_rates/status/885167619883638784/photo/1,https://twitter.com/dog_rates/status/885167619883638784/photo/1",13,10,,,https://pbs.twimg.com/media/DEi_N9qXYAAgEEw.jpg,4,Malamute,3732,19594
30,884925521741709313,2017-07-12 00:01:00+00:00,"<a href=""http://twitter.com/download/iphone"" rel=""nofollow"">Twitter for iPhone</a>","This is Earl. He found a hat. Nervous about what you think of it. 12/10 it's delightful, Earl https://t.co/MYJvdlNRVa",https://twitter.com/dog_rates/status/884925521741709313/photo/1,12,10,Earl,,https://pbs.twimg.com/media/DEfjEaNXkAAtPlj.jpg,1,Italian Greyhound,15358,68637
31,884876753390489601,2017-07-11 20:47:12+00:00,"<a href=""http://twitter.com/download/iphone"" rel=""nofollow"">Twitter for iPhone</a>",This is Lola. It's her first time outside. Must test the earth and taste the atmosphere. 13/10 you're doing great Lola https://t.co/74TKAUsLkO,"https://twitter.com/dog_rates/status/884876753390489601/photo/1,https://twitter.com/dog_rates/status/884876753390489601/photo/1,https://twitter.com/dog_rates/status/884876753390489601/photo/1,https://twitter.com/dog_rates/status/884876753390489601/photo/1",13,10,Lola,,https://pbs.twimg.com/media/DEe2tZXXkAAwyX3.jpg,1,Chow,4759,24873
32,884562892145688576,2017-07-11 00:00:02+00:00,"<a href=""http://twitter.com/download/iphone"" rel=""nofollow"">Twitter for iPhone</a>",This is Kevin. He's just so happy. 13/10 what is your secret Kevin https://t.co/1r4MFCbCX5,https://twitter.com/dog_rates/status/884562892145688576/photo/1,13,10,Kevin,,https://pbs.twimg.com/media/DEaZQkfXUAEC7qB.jpg,1,Pug,3992,21735
33,884441805382717440,2017-07-10 15:58:53+00:00,"<a href=""http://twitter.com/download/iphone"" rel=""nofollow"">Twitter for iPhone</a>","I present to you, Pup in Hat. Pup in Hat is great for all occasions. Extremely versatile. Compact as h*ck. 14/10 (IG: itselizabethgales) https://t.co/vvBOcC2VdC",https://twitter.com/dog_rates/status/884441805382717440/photo/1,14,10,,,https://pbs.twimg.com/media/DEYrIZwWsAA2Wo5.jpg,1,Pembroke,4873,24310
34,884162670584377345,2017-07-09 21:29:42+00:00,"<a href=""http://twitter.com/download/iphone"" rel=""nofollow"">Twitter for iPhone</a>",Meet Yogi. He doesn't have any important dog meetings today he just enjoys looking his best at all times. 12/10 for dangerously dapper doggo https://t.co/YSI00BzTBZ,https://twitter.com/dog_rates/status/884162670584377345/photo/1,12,10,Yogi,doggo,https://pbs.twimg.com/media/DEUtQbzW0AUTv_o.jpg,1,German Shepherd,2539,18283
35,883838122936631299,2017-07-09 00:00:04+00:00,"<a href=""http://twitter.com/download/iphone"" rel=""nofollow"">Twitter for iPhone</a>",This is Noah. He can't believe someone made this mess. Got the vacuum out for you though. Offered to help clean pup. 12/10 super good boy https://t.co/V85xujjDDY,https://twitter.com/dog_rates/status/883838122936631299/photo/1,12,10,Noah,,https://pbs.twimg.com/media/DEQGFgAXUAAEvfi.jpg,1,Doberman,2920,19555
36,883482846933004288,2017-07-08 00:28:19+00:00,"<a href=""http://twitter.com/download/iphone"" rel=""nofollow"">Twitter for iPhone</a>","This is Bella. She hopes her smile made you smile. If not, she is also offering you her favorite monkey. 13.5/10 https://t.co/qjrljjt948","https://twitter.com/dog_rates/status/883482846933004288/photo/1,https://twitter.com/dog_rates/status/883482846933004288/photo/1",5,10,Bella,,https://pbs.twimg.com/media/DELC9dZXUAADqUk.jpg,1,Golden Retriever,8431,41002
37,883360690899218434,2017-07-07 16:22:55+00:00,"<a href=""http://twitter.com/download/iphone"" rel=""nofollow"">Twitter for iPhone</a>",Meet Grizzwald. He may be the floofiest floofer I ever did see. Lost eyes saving a schoolbus from a volcano erpuption. 13/10 heroic as h*ck https://t.co/rf661IFEYP,https://twitter.com/dog_rates/status/883360690899218434/photo/1,13,10,Grizzwald,floofer,https://pbs.twimg.com/media/DEJT3FeXoAAtwUy.jpg,1,Chow,3141,20317
38,883117836046086144,2017-07-07 00:17:54+00:00,"<a href=""http://twitter.com/download/iphone"" rel=""nofollow"">Twitter for iPhone</a>","Please only send dogs. We don't rate mechanics, no matter how h*ckin good. Thank you... 13/10 would sneak a pat https://t.co/Se5fZ9wp5E","https://twitter.com/dog_rates/status/883117836046086144/photo/1,https://twitter.com/dog_rates/status/883117836046086144/photo/1",13,10,,,https://pbs.twimg.com/media/DEF2-_hXoAAs62q.jpg,2,Golden Retriever,5643,33149
39,882992080364220416,2017-07-06 15:58:11+00:00,"<a href=""http://twitter.com/download/iphone"" rel=""nofollow"">Twitter for iPhone</a>",This is Rusty. He wasn't ready for the first pic. Clearly puppared for the second. 13/10 confirmed great boy https://t.co/tyER0KpdXj,"https://twitter.com/dog_rates/status/882992080364220416/photo/1,https://twitter.com/dog_rates/status/882992080364220416/photo/1",13,10,Rusty,,https://pbs.twimg.com/media/DEEEnIqXYAAiJh_.jpg,1,Eskimo Dog,3299,21359
40,882762694511734784,2017-07-06 00:46:41+00:00,"<a href=""http://twitter.com/download/iphone"" rel=""nofollow"">Twitter for iPhone</a>",This is Gus. He's quite the cheeky pupper. Already perfected the disinterested wink. 12/10 would let steal my girl https://t.co/D43I96SlVu,https://twitter.com/dog_rates/status/882762694511734784/photo/1,12,10,Gus,pupper,https://pbs.twimg.com/media/DEAz_HHXsAA-p_z.jpg,1,Labrador Retriever,4180,25262
41,882627270321602560,2017-07-05 15:48:34+00:00,"<a href=""http://twitter.com/download/iphone"" rel=""nofollow"">Twitter for iPhone</a>",This is Stanley. He has his first swim lesson today. Doggle straps adjusted. Ready to go. 13/10 Phelps is nervous (IG: stanleythe_corgi) https://t.co/Nx52PGwH94,https://twitter.com/dog_rates/status/882627270321602560/photo/1,13,10,Stanley,,https://pbs.twimg.com/media/DD-40X3WAAAJPU5.jpg,1,Pembroke,5180,25091
42,882268110199369728,2017-07-04 16:01:23+00:00,"<a href=""http://twitter.com/download/iphone"" rel=""nofollow"">Twitter for iPhone</a>",This is Alfy. You're witnessing his first watermelon experience. I think it was a success. 13/10 happy 4th Alfy ðŸ‡ºðŸ‡¸ https://t.co/fYP5RlutfA,"https://twitter.com/dog_rates/status/882268110199369728/photo/1,https://twitter.com/dog_rates/status/882268110199369728/photo/1,https://twitter.com/dog_rates/status/882268110199369728/photo/1",13,10,Alfy,,https://pbs.twimg.com/media/DD5yKdPW0AArzX8.jpg,1,Golden Retriever,9866,39954
43,882045870035918850,2017-07-04 01:18:17+00:00,"<a href=""http://twitter.com/download/iphone"" rel=""nofollow"">Twitter for iPhone</a>","This is Koko. Her owner, inspired by Barney, recently built a cart for her to use during walks if she got tired. 13/10 rest easy Koko https://t.co/zeDpnsKX7w","https://twitter.com/dog_rates/status/882045870035918850/photo/1,https://twitter.com/dog_rates/status/882045870035918850/photo/1,https://twitter.com/dog_rates/status/882045870035918850/photo/1,https://twitter.com/dog_rates/status/882045870035918850/photo/1",13,10,Koko,,https://pbs.twimg.com/media/DD2oCl2WAAEI_4a.jpg,1,Golden Retriever,4162,26241
44,881906580714921986,2017-07-03 16:04:48+00:00,"<a href=""http://twitter.com/download/iphone"" rel=""nofollow"">Twitter for iPhone</a>",This is Rey. He's a Benebop Cumberfloof. 12/10 dangerously pettable https://t.co/503CgWbhxQ,https://twitter.com/dog_rates/status/881906580714921986/photo/1,12,10,Rey,,https://pbs.twimg.com/media/DD0pWm9XcAAeSBL.jpg,1,Weimaraner,2903,21840
45,881666595344535552,2017-07-03 00:11:11+00:00,"<a href=""http://twitter.com/download/iphone"" rel=""nofollow"">Twitter for iPhone</a>",This is Gary. He couldn't miss this puppertunity for a selfie. Flawless focusing skills. 13/10 would boop intensely https://t.co/7CSWCl8I6s,https://twitter.com/dog_rates/status/881666595344535552/photo/1,13,10,Gary,,https://pbs.twimg.com/media/DDxPFwbWAAEbVVR.jpg,1,Saluki,9143,45394
46,881536004380872706,2017-07-02 15:32:16+00:00,"<a href=""http://twitter.com/download/iphone"" rel=""nofollow"">Twitter for iPhone</a>","Here is a pupper approaching maximum borkdrive. Zooming at never before seen speeds. 14/10 paw-inspiring af 
(IG: puffie_the_chow) https://t.co/ghXBIIeQZF",https://twitter.com/dog_rates/status/881536004380872706/video/1,14,10,,pupper,https://pbs.twimg.com/ext_tw_video_thumb/881535971568889856/pu/img/9bawiZ--8FKywTkz.jpg,1,Samoyed,13674,44261
47,880872448815771648,2017-06-30 19:35:32+00:00,"<a href=""http://twitter.com/download/iphone"" rel=""nofollow"">Twitter for iPhone</a>",Ugh not again. We only rate dogs. Please don't send in well-dressed  floppy-tongued street penguins. Dogs only please. Thank you... 12/10 https://t.co/WiAMbTkDPf,https://twitter.com/dog_rates/status/880872448815771648/photo/1,12,10,,,https://pbs.twimg.com/media/DDl8zzJW0AAisCJ.jpg,1,Pembroke,3266,19078
48,880465832366813184,2017-06-29 16:39:47+00:00,"<a href=""http://twitter.com/download/iphone"" rel=""nofollow"">Twitter for iPhone</a>",This is Bella. She had her first beach experience this morning. Complete success. 12/10 would perform a sandy boop https://t.co/4VsFysDmiw,"https://twitter.com/dog_rates/status/880465832366813184/photo/1,https://twitter.com/dog_rates/status/880465832366813184/photo/1,https://twitter.com/dog_rates/status/880465832366813184/photo/1,https://twitter.com/dog_rates/status/880465832366813184/photo/1",12,10,Bella,,https://pbs.twimg.com/media/DDgK-J4XUAIEV9W.jpg,1,Golden Retriever,5309,25468
49,880221127280381952,2017-06-29 00:27:25+00:00,"<a href=""http://twitter.com/download/iphone"" rel=""nofollow"">Twitter for iPhone</a>",Meet Jesse. He's a Fetty Woof. His tongue ejects without warning. A true bleptomaniac. 12/10 would snug well https://t.co/fUod0tVmvK,"https://twitter.com/dog_rates/status/880221127280381952/photo/1,https://twitter.com/dog_rates/status/880221127280381952/photo/1",12,10,Jesse,,https://pbs.twimg.com/media/DDcscbXU0AIfDzs.jpg,1,Chihuahua,3553,24122
50,880095782870896641,2017-06-28 16:09:20+00:00,"<a href=""http://twitter.com/download/iphone"" rel=""nofollow"">Twitter for iPhone</a>",Please don't send in photos without dogs in them. We're not @porch_rates. Insubordinate and churlish. Pretty good porch tho 11/10 https://t.co/HauE8M3Bu4,https://twitter.com/dog_rates/status/880095782870896641/photo/1,11,10,,,https://pbs.twimg.com/media/DDa6ckbXgAAM1vV.jpg,1,Miniature Pinscher,3728,24775
51,879862464715927552,2017-06-28 00:42:13+00:00,"<a href=""http://twitter.com/download/iphone"" rel=""nofollow"">Twitter for iPhone</a>",This is Romeo. He would like to do an entrance. Requesting your immediate assistance. 13/10 https://t.co/Qh5aEkRQm9,"https://twitter.com/dog_rates/status/879862464715927552/photo/1,https://twitter.com/dog_rates/status/879862464715927552/photo/1,https://twitter.com/dog_rates/status/879862464715927552/photo/1",13,10,Romeo,,https://pbs.twimg.com/media/DDXmPrbWAAEKMvy.jpg,3,Basset,2986,20076
52,879492040517615616,2017-06-27 00:10:17+00:00,"<a href=""http://twitter.com/download/iphone"" rel=""nofollow"">Twitter for iPhone</a>",This is Bailey. He thinks you should measure ear length for signs of growth instead. 12/10 https://t.co/IxM9IMKQq8,https://twitter.com/dog_rates/status/879492040517615616/photo/1,12,10,Bailey,,https://pbs.twimg.com/media/DDSVWMvXsAEgmMK.jpg,1,German Short-Haired Pointer,2692,21097
53,879415818425184262,2017-06-26 19:07:24+00:00,"<a href=""http://twitter.com/download/iphone"" rel=""nofollow"">Twitter for iPhone</a>",This is Duddles. He did an attempt. 13/10 someone help him (vid by Georgia Felici) https://t.co/UDT7ZkcTgY,https://twitter.com/dog_rates/status/879415818425184262/video/1,13,10,Duddles,,https://pbs.twimg.com/ext_tw_video_thumb/879415784908390401/pu/img/cX7XI1TnUsseGET5.jpg,1,English Springer,38224,94609
